rating,content,class,content_clean,content_clean_pt,length,positive_count,negative_count,class_new
5,"Sản phẩm/dịch vụ giống mô tả và tốt hơn mong đợi. Chất lượng sản phẩm/dịch vụ rất tốt. Gửi sản phẩm/vé dịch vụ nhanh. Shop tư vấn, hướng dẫn cực kỳ nhiệt tình. dat moi, tặng phẩm đẹp. thank shop",1,sản phẩm dịch vụ giống mô tả và tốt hơn mong đợi chất lượng sản phẩm dịch vụ rất tốt gửi sản phẩm vé dịch vụ nhanh shop tư vấn hướng dẫn cực kỳ nhiệt tình dat moi tặng phẩm đẹp thank shop,sản_phẩm_dịch_vụ_giống_mô_tả tốt_hơn_mong_đợi chất_lượng sản_phẩm_dịch_vụ_rất_tốt gửi_sản_phẩm vé_dịch_vụ cửa_hàng tư_vấn hướng_dẫn_nhiệt_tình tặng_phẩm đẹp cửa_hàng,190,5,0,1
5,"Chuyên nghiệp, thân thiện. Đẹp như mô tả. Đóng gói kỹ lưỡng. Chất lượng tuyệt vời. Giá tốt. Giao hàng nhanh, lần nào cũng được tặng gối, cảm ơn shop",1,chuyên nghiệp thân thiện đẹp như mô tả đóng gói kỹ lưỡng chất lượng tuyệt vời giá tốt giao hàng nhanh lần nào cũng được tặng gối cảm ơn shop,chuyên_nghiệp thân_thiện đẹp như_mô_tả đóng_gói_kỹ_lưỡng chất_lượng_tuyệt_vời giá_tốt giao_hàng tặng gối cửa_hàng,140,7,0,1
5,Rất hài lòng ❤️❤️❤️❤️❤️❤️❤️❤️,1,rất hài lòng yêu yêu yêu yêu yêu yêu yêu yêu,hài_lòng yêu yêu yêu yêu yêu yêu yêu yêu,44,0,0,1
5,Gửi sản phẩm/vé dịch vụ nhanh. Chất lượng sản phẩm/dịch vụ rất tốt.,1,gửi sản phẩm vé dịch vụ nhanh chất lượng sản phẩm dịch vụ rất tốt,gửi_sản_phẩm vé_dịch_vụ chất_lượng sản_phẩm_dịch_vụ_rất_tốt,65,1,0,1
5,Đóng gói kỹ lưỡng. Giao hàng nhanh bất ngờ. tam cho 5 sao tả mỏng tham hút tốt có điều là giao tả kg có giống với mẫu trên bao bì và tả sao kg thấy để hiệu gì hết,1,đóng gói kỹ lưỡng giao hàng nhanh bất ngờ tam cho 5 sao tả mỏng tham hút tốt có điều là giao tả kg có giống với mẫu trên bao bì và tả sao kg thấy để hiệu gì hết,đóng_gói_kỹ_lưỡng giao_hàng _sao_tả mỏng tham_hút tốt giao_tả mẫu bì_tả không_thấy hiệu,166,2,1,1
5,"Chuyên nghiệp, thân thiện. Đẹp như mô tả. Đóng gói kỹ lưỡng. Chất lượng tuyệt vời. Giá tốt. Giao hàng nhanh bất ngờ. giao hàng nhanh chóng. hàng chuẩn y hình. so với dòng khác. bé mình dùng ko bị hăm. dùng các khác là hăm mông luôn. hichic",1,chuyên nghiệp thân thiện đẹp như mô tả đóng gói kỹ lưỡng chất lượng tuyệt vời giá tốt giao hàng nhanh bất ngờ giao hàng nhanh chóng hàng chuẩn y hình so với dòng khác bé mình dùng ko bị hăm dùng các khác là hăm mông luôn hichic,chuyên_nghiệp thân_thiện đẹp như_mô_tả đóng_gói_kỹ_lưỡng chất_lượng_tuyệt_vời giá_tốt giao_hàng giao_hàng_nhanh_chóng hàng chuẩn y_hình dòng bé không_bị hăm hăm_mông hichic,230,8,0,1
5,"Sản phẩm/dịch vụ giống mô tả và tốt hơn mong đợi. Chất lượng sản phẩm/dịch vụ rất tốt. Gửi sản phẩm/vé dịch vụ nhanh. Shop tư vấn, hướng dẫn cực kỳ nhiệt tình. shop giao khá nhanh. chưa dùng thử chưa biết chất lượng sao",1,sản phẩm dịch vụ giống mô tả và tốt hơn mong đợi chất lượng sản phẩm dịch vụ rất tốt gửi sản phẩm vé dịch vụ nhanh shop tư vấn hướng dẫn cực kỳ nhiệt tình shop giao khá nhanh chưa dùng thử chưa biết chất lượng sao,sản_phẩm_dịch_vụ_giống_mô_tả tốt_hơn_mong_đợi chất_lượng sản_phẩm_dịch_vụ_rất_tốt gửi_sản_phẩm vé_dịch_vụ cửa_hàng tư_vấn hướng_dẫn_nhiệt_tình cửa_hàng thử chất_lượng,213,4,0,1
5,Sản phẩm/dịch vụ giống mô tả và tốt hơn mong đợi. Chất lượng sản phẩm/dịch vụ rất tốt. Gửi sản phẩm/vé dịch vụ nhanh. sản phẩm ok,1,sản phẩm dịch vụ giống mô tả và tốt hơn mong đợi chất lượng sản phẩm dịch vụ rất tốt gửi sản phẩm vé dịch vụ nhanh sản phẩm ok,sản_phẩm_dịch_vụ_giống_mô_tả tốt_hơn_mong_đợi chất_lượng sản_phẩm_dịch_vụ_rất_tốt gửi_sản_phẩm vé_dịch_vụ sản_phẩm_ổn,126,4,0,1
5,Gửi sản phẩm/vé dịch vụ nhanh. sản phẩm ok. shop giao hàng nhanh,1,gửi sản phẩm vé dịch vụ nhanh sản phẩm ok shop giao hàng nhanh,gửi_sản_phẩm vé_dịch_vụ sản_phẩm_ổn cửa_hàng giao_hàng,62,1,0,1
3,Giao hàng tạm ổn. giao hàng hơi lâu,0,giao hàng tạm ổn giao hàng hơi lâu,giao_hàng tạm ổn giao_hàng,34,1,0,1
4,Chất lượng tốt.,1,chất lượng tốt,chất_lượng_tốt,14,1,0,1
5,hơi mỏng,1,hơi mỏng,mỏng,8,0,1,0
2,Sản phẩm/dịch vụ chỉ hơi giống mô tả.,0,sản phẩm dịch vụ chỉ hơi giống mô tả,sản_phẩm_dịch_vụ_hơi_giống_mô_tả,36,0,1,0
5,không như mong đợi.,1,không như mong đợi,không_như_mong_đợi,18,0,1,0
5,"Sản phẩm/dịch vụ giống mô tả và tốt hơn mong đợi. Chất lượng sản phẩm/dịch vụ rất tốt. Gửi sản phẩm/vé dịch vụ nhanh. Shop tư vấn, hướng dẫn cực kỳ nhiệt tình. tốt hơn mong đợi cám on shop nhiều lắm",1,sản phẩm dịch vụ giống mô tả và tốt hơn mong đợi chất lượng sản phẩm dịch vụ rất tốt gửi sản phẩm vé dịch vụ nhanh shop tư vấn hướng dẫn cực kỳ nhiệt tình tốt hơn mong đợi cám on shop nhiều lắm,sản_phẩm_dịch_vụ_giống_mô_tả tốt_hơn_mong_đợi chất_lượng sản_phẩm_dịch_vụ_rất_tốt gửi_sản_phẩm vé_dịch_vụ cửa_hàng tư_vấn hướng_dẫn_nhiệt_tình tốt_hơn_mong_đợi cám cửa_hàng lắm,193,5,0,1
2,Chất lượng cần tốt hơn. Bỉm thấm hút kém quá toàn bị trào ngược ra,0,chất lượng cần tốt hơn bỉm thấm hút kém quá toàn bị trào ngược ra,chất_lượng_cần_tốt_hơn bỉm thấm_hút kém toàn trào ngược,65,0,2,0
5,"Hom nay moi mo ra xai,rat ok nhe shop",1,hom nay moi mo ra xai rat ok nhe shop,moi_mo ổn cửa_hàng,37,1,0,1
5,shop giao hang rat nhanh luon.chat luong đi đôi voi gia tiền .se ung ho tiep nhé,1,shop giao hang rat nhanh luon chat luong đi đôi voi gia tiền se ung ho tiep nhé,cửa_hàng chất_lượng đôi tiền ung_ho,81,0,0,1
5,hàng giao đúng mẫu.xài tốt lắm .shop hướng dẫn rất nhiệt tình và shipper dễ thương sẽ ủng hộ shop lâu dài,1,hàng giao đúng mẫu xài tốt lắm shop hướng dẫn rất nhiệt tình và shipper dễ thương sẽ ủng hộ shop lâu dài,hàng mẫu xài tốt lắm cửa_hàng hướng_dẫn_nhiệt_tình shipper dễ_thương ủng_hộ cửa_hàng lâu_dài,104,2,1,1
5,"Chuyên nghiệp, thân thiện. Đẹp như mô tả. Đóng gói kỹ lưỡng. Chất lượng tuyệt vời. Giá tốt. Giao hàng nhanh bất ngờ. dong nhu mo ta",1,chuyên nghiệp thân thiện đẹp như mô tả đóng gói kỹ lưỡng chất lượng tuyệt vời giá tốt giao hàng nhanh bất ngờ dong nhu mo ta,chuyên_nghiệp thân_thiện đẹp như_mô_tả đóng_gói_kỹ_lưỡng chất_lượng_tuyệt_vời giá_tốt giao_hàng nhanh_dong mô_tả,124,7,0,1
5,"shop bán chảnh chó,nt đọc xong k thèm tl,còn hay k cũng k thèm xac nhận để khách chờ mòn mỏi 2ngày rồi hủy đơn ????",1,shop bán chảnh chó nt đọc xong k thèm tl còn hay k cũng k thèm xac nhận để khách chờ mòn mỏi 2ngày rồi hủy đơn,cửa_hàng chảnh chó đọc không_thèm trả_lời không_cũng không_thèm chờ mòn_mỏi hủy đơn,143,0,0,1
3,có 25 miếng tả bị lỗi nhẹ xài hết 25 miếng lớp trên tới lớp dưới mới thấy khác nhau hi vọng mua lần sau sẽ không bị lỗi,0,có 25 miếng tả bị lỗi nhẹ xài hết 25 miếng lớp trên tới lớp dưới mới thấy khác nhau hi vọng mua lần sau sẽ không bị lỗi,miếng_tả lỗi nhẹ xài miếng lớp lớp hi_vọng không_bị lỗi,119,0,0,0
4,chất tả thô cứng. chất lượng không như những lần trước. hơi thất vọng về shop.,1,chất tả thô cứng chất lượng không như những lần trước hơi thất vọng về shop,chất_tả thô cứng chất_lượng không_như thất_vọng cửa_hàng,75,0,2,0
5,"Chuyên nghiệp, thân thiện. Đóng gói kỹ lưỡng. Chất lượng tuyệt vời. bỉm mỏng nhẹ thấm hút tốt .bé mặc ko bị hăm sẽ ủng hộ shop lần sau",1,chuyên nghiệp thân thiện đóng gói kỹ lưỡng chất lượng tuyệt vời bỉm mỏng nhẹ thấm hút tốt bé mặc ko bị hăm sẽ ủng hộ shop lần sau,chuyên_nghiệp thân_thiện đóng_gói_kỹ_lưỡng chất_lượng_tuyệt_vời bỉm mỏng nhẹ thấm_hút tốt bé mặc không_bị hăm ủng_hộ cửa_hàng,132,5,1,1
5,"Chuyên nghiệp, thân thiện. Đẹp như mô tả. Đóng gói kỹ lưỡng. Chất lượng tuyệt vời. Giá tốt. Giao hàng nhanh bất ngờ. đúng size OK",1,chuyên nghiệp thân thiện đẹp như mô tả đóng gói kỹ lưỡng chất lượng tuyệt vời giá tốt giao hàng nhanh bất ngờ đúng size ok,chuyên_nghiệp thân_thiện đẹp như_mô_tả đóng_gói_kỹ_lưỡng chất_lượng_tuyệt_vời giá_tốt giao_hàng_ổn,122,8,0,1
5,Giao hàng nhanh bất ngờ. giao hàng đúng size mà mỗi bọc ko đủ năm chục cái thiếu mỗi gói hai cái có 48 miếng thôi mong shop để đủ số lượng nhe đừng để thiếu hoài thất vọng quá tạm hài lòng cho năm sao,1,giao hàng nhanh bất ngờ giao hàng đúng size mà mỗi bọc ko đủ năm chục cái thiếu mỗi gói hai cái có 48 miếng thôi mong shop để đủ số lượng nhe đừng để thiếu hoài thất vọng quá tạm hài lòng cho năm sao,giao_hàng giao_hàng bọc không_đủ chục gói miếng cửa_hàng số_lượng đừng hoài thất_vọng tạm hài_lòng,202,0,1,0
5,tiền nào của nấy hàng ok cho shop 5 sao,1,tiền nào của nấy hàng ok cho shop 5 sao,tiền hàng_ổn cửa_hàng_ _sao,39,2,0,1
5,"giao nhanh bất ngờ,shop nhiệt tình,bỉm chính hãng ,mỏng nhẹ",1,giao nhanh bất ngờ shop nhiệt tình bỉm chính hãng mỏng nhẹ,cửa_hàng_nhiệt_tình bỉm hãng mỏng nhẹ,58,1,1,1
5,"Chuyên nghiệp, thân thiện. Đóng gói kỹ lưỡng. Giá tốt.",1,chuyên nghiệp thân thiện đóng gói kỹ lưỡng giá tốt,chuyên_nghiệp thân_thiện đóng_gói_kỹ_lưỡng giá_tốt,50,4,0,1
4,Đúng mô tả. tả hello ko thấm bằng tả có hình con gấu,1,đúng mô tả tả hello ko thấm bằng tả có hình con gấu,đúng_mô_tả tả không_thấm tả_hình gấu,54,1,0,1
5,"Chuyên nghiệp, thân thiện. Đẹp như mô tả. Đóng gói kỹ lưỡng. Chất lượng tuyệt vời. Giá tốt. Giao hàng nhanh bất ngờ. nên mua hang ở shop nay nhé moi người uy tính chất lương",1,chuyên nghiệp thân thiện đẹp như mô tả đóng gói kỹ lưỡng chất lượng tuyệt vời giá tốt giao hàng nhanh bất ngờ nên mua hang ở shop nay nhé moi người uy tính chất lương,chuyên_nghiệp thân_thiện đẹp như_mô_tả đóng_gói_kỹ_lưỡng chất_lượng_tuyệt_vời giá_tốt giao_hàng cửa_hàng uy_tính_chất lương,166,7,0,1
3,Chưa chuyên nghiệp. tả đợt này và đợt trước thấm hút hơi tệ. những đợt tả đầu thì ok. ko biết có nên đặt tiếp ko!!!,0,chưa chuyên nghiệp tả đợt này và đợt trước thấm hút hơi tệ những đợt tả đầu thì ok ko biết có nên đặt tiếp ko,chưa_chuyên_nghiệp_tả đợt đợt thấm hút_tệ đợt tả đầu ổn tiếp không,115,1,0,1
2,lần này mua tã k giống như mong đợi.ta hoi mỏng mặc vô kéo lên là tét ra het .thật sự rất thật vọng.k sử dụng đc ln,0,lần này mua tã k giống như mong đợi ta hoi mỏng mặc vô kéo lên là tét ra het thật sự rất thật vọng k sử dụng đc ln,tã không_giống như_mong_đợi ta_hoi mỏng mặc vô kéo tét thật_sự_thật vọng không_sử_dụng ln,124,1,1,0
4,mua nhiêu lầu như tả lầy này mỏng quá,1,mua nhiêu lầu như tả lầy này mỏng quá,nhiêu lầu tả lầy mỏng,37,0,1,0
5,bỉm dẹp nhưng fom này hơi nhỏ số vs lần truớc,1,bỉm dẹp nhưng fom này hơi nhỏ số vs lần truớc,bỉm dẹp,46,0,0,1
5,giao hàng nhanh tã đẹp sẽ ủng hộ shop nữa,1,giao hàng nhanh tã đẹp sẽ ủng hộ shop nữa,giao_hàng tã đẹp ủng_hộ cửa_hàng,41,1,0,1
5,tả lần này nhiều hình. size có ghi lên tả. mỏng hơn cái cũ. nhưng thấm hút tốt,1,tả lần này nhiều hình size có ghi lên tả mỏng hơn cái cũ nhưng thấm hút tốt,tả hình_size tả mỏng cũ thấm hút tốt,75,1,2,0
1,"lừa đảo , trước và sau khác nhau . hàng mỏng và cứng không như mô tả . làm ăn ***",0,lừa đảo trước và sau khác nhau hàng mỏng và cứng không như mô tả làm ăn ***,lừa_đảo hàng_mỏng cứng không_như_mô_tả làm_ăn * * *,75,0,2,0
4,mình xem trong phần mô tả chi tiết . thì thấy là xuất sứ Việt Nam. nhưng trông bỉm thì in Chử tàu là sau .?..,1,mình xem trong phần mô tả chi tiết thì thấy là xuất sứ việt nam nhưng trông bỉm thì in chử tàu là sau,mô_tả chi_tiết xuất_sứ việt_nam trông bỉm chử tàu,101,0,0,1
5,"Sản phẩm/dịch vụ giống mô tả và tốt hơn mong đợi. Chất lượng sản phẩm/dịch vụ rất tốt. Gửi sản phẩm/vé dịch vụ nhanh. Shop tư vấn, hướng dẫn cực kỳ nhiệt tình. hàng giống hình. Chất lượng sp thấm hút tốt.",1,sản phẩm dịch vụ giống mô tả và tốt hơn mong đợi chất lượng sản phẩm dịch vụ rất tốt gửi sản phẩm vé dịch vụ nhanh shop tư vấn hướng dẫn cực kỳ nhiệt tình hàng giống hình chất lượng sp thấm hút tốt,sản_phẩm_dịch_vụ_giống_mô_tả tốt_hơn_mong_đợi chất_lượng sản_phẩm_dịch_vụ_rất_tốt gửi_sản_phẩm vé_dịch_vụ cửa_hàng tư_vấn hướng_dẫn_nhiệt_tình hàng hình chất_lượng sản_phẩm thấm hút tốt,203,5,0,1
5,"Sản phẩm/dịch vụ giống mô tả và tốt hơn mong đợi. Chất lượng sản phẩm/dịch vụ rất tốt. Gửi sản phẩm/vé dịch vụ nhanh. Shop tư vấn, hướng dẫn cực kỳ nhiệt tình. bỉm mềm, mỏng, thấm nhanh, sẽ ủng hộ shop tiếp.",1,sản phẩm dịch vụ giống mô tả và tốt hơn mong đợi chất lượng sản phẩm dịch vụ rất tốt gửi sản phẩm vé dịch vụ nhanh shop tư vấn hướng dẫn cực kỳ nhiệt tình bỉm mềm mỏng thấm nhanh sẽ ủng hộ shop tiếp,sản_phẩm_dịch_vụ_giống_mô_tả tốt_hơn_mong_đợi chất_lượng sản_phẩm_dịch_vụ_rất_tốt gửi_sản_phẩm vé_dịch_vụ cửa_hàng tư_vấn hướng_dẫn_nhiệt_tình bỉm mềm_mỏng thấm ủng_hộ cửa_hàng tiếp,198,4,0,1
5,Đóng gói kỹ lưỡng. Chất lượng tuyệt vời. Giá tốt. Giao hàng nhanh bất ngờ.,1,đóng gói kỹ lưỡng chất lượng tuyệt vời giá tốt giao hàng nhanh bất ngờ,đóng_gói_kỹ_lưỡng chất_lượng_tuyệt_vời giá_tốt giao_hàng,70,3,0,1
5,"Chuyên nghiệp, thân thiện. Chất lượng tuyệt vời. Giá tốt. Giao hàng nhanh bất ngờ.",1,chuyên nghiệp thân thiện chất lượng tuyệt vời giá tốt giao hàng nhanh bất ngờ,chuyên_nghiệp thân_thiện chất_lượng_tuyệt_vời giá_tốt giao_hàng,77,4,0,1
5,Đẹp như mô tả. Đóng gói kỹ lưỡng. Chất lượng tuyệt vời.,1,đẹp như mô tả đóng gói kỹ lưỡng chất lượng tuyệt vời,đẹp như_mô_tả đóng_gói_kỹ_lưỡng chất_lượng_tuyệt_vời,52,4,0,1
5,đóng gói hàng còn sơ xài chưa tốt. lần sau mua mong shop đóng hàng kỉ hơn.,1,đóng gói hàng còn sơ xài chưa tốt lần sau mua mong shop đóng hàng kỉ hơn,đóng_gói hàng sơ_xài chưa_tốt cửa_hàng đóng hàng_kỉ,72,0,1,0
5,"Đẹp như mô tả. Giá tốt. date xa tới năm 2023, mua dc lúc flast sale, dc hỗ trợ ship còn 114k luôn cho shop 5*",1,đẹp như mô tả giá tốt date xa tới năm 2023 mua dc lúc flast sale dc hỗ trợ ship còn 114k luôn cho shop 5*,đẹp như_mô_tả giá_tốt date flast giao_hàng ngàn cửa_hàng_ _sao,121,4,0,1
5,"Chuyên nghiệp, thân thiện. Đẹp như mô tả. Đóng gói kỹ lưỡng. Giá tốt. Giao hàng nhanh bất ngờ. Tuyệt cú mèo",1,chuyên nghiệp thân thiện đẹp như mô tả đóng gói kỹ lưỡng giá tốt giao hàng nhanh bất ngờ tuyệt cú mèo,chuyên_nghiệp thân_thiện đẹp như_mô_tả đóng_gói_kỹ_lưỡng giá_tốt giao_hàng tuyệt_cú mèo,101,6,0,1
3,"Bim tot ,xac’ định đơn hang lâu, giao hàng chậm",0,bim tot xac’ định đơn hang lâu giao hàng chậm,tốt ’ định đơn giao_hàng_chậm,45,1,1,0
5,Giá tốt. mọi ng nên mua,1,giá tốt mọi ng nên mua,giá_tốt,25,1,0,1
5,Đóng gói kỹ lưỡng. shop đóng gói kỹ lưỡng cám ơn shop,1,đóng gói kỹ lưỡng shop đóng gói kỹ lưỡng cám ơn shop,đóng_gói_kỹ_lưỡng cửa_hàng đóng_gói_kỹ_lưỡng cám_ơn cửa_hàng,52,2,0,1
5,"Chuyên nghiệp, thân thiện. Đẹp như mô tả. Đóng gói kỹ lưỡng. Chất lượng tuyệt vời. Giao hàng nhanh bất ngờ. Giá tốt.",1,chuyên nghiệp thân thiện đẹp như mô tả đóng gói kỹ lưỡng chất lượng tuyệt vời giao hàng nhanh bất ngờ giá tốt,chuyên_nghiệp thân_thiện đẹp như_mô_tả đóng_gói_kỹ_lưỡng chất_lượng_tuyệt_vời giao_hàng giá_tốt,109,7,0,1
5,Sản phẩm/dịch vụ giống mô tả và tốt hơn mong đợi. Chất lượng sản phẩm/dịch vụ rất tốt. sp ok. hạn sử dụng lâu. ủng hộ shop,1,sản phẩm dịch vụ giống mô tả và tốt hơn mong đợi chất lượng sản phẩm dịch vụ rất tốt sp ok hạn sử dụng lâu ủng hộ shop,sản_phẩm_dịch_vụ_giống_mô_tả tốt_hơn_mong_đợi chất_lượng sản_phẩm_dịch_vụ_rất_tốt sản_phẩm ổn_hạn ủng_hộ cửa_hàng,124,3,0,1
5,Chất lượng sản phẩm/dịch vụ rất tốt. Sản phẩm/dịch vụ giống mô tả và tốt hơn mong đợi. Bỉm ok giá lại rẻ. Nên mua nhé mn,1,chất lượng sản phẩm dịch vụ rất tốt sản phẩm dịch vụ giống mô tả và tốt hơn mong đợi bỉm ok giá lại rẻ nên mua nhé mn,chất_lượng sản_phẩm_dịch_vụ_rất_tốt sản_phẩm_dịch_vụ_giống_mô_tả tốt_hơn_mong_đợi bỉm ổn giá rẻ,124,4,0,1
5,"Sản phẩm/dịch vụ giống mô tả và tốt hơn mong đợi. Chất lượng sản phẩm/dịch vụ rất tốt. Gửi sản phẩm/vé dịch vụ nhanh. Shop tư vấn, hướng dẫn cực kỳ nhiệt tình. quá tốt",1,sản phẩm dịch vụ giống mô tả và tốt hơn mong đợi chất lượng sản phẩm dịch vụ rất tốt gửi sản phẩm vé dịch vụ nhanh shop tư vấn hướng dẫn cực kỳ nhiệt tình quá tốt,sản_phẩm_dịch_vụ_giống_mô_tả tốt_hơn_mong_đợi chất_lượng sản_phẩm_dịch_vụ_rất_tốt gửi_sản_phẩm vé_dịch_vụ cửa_hàng tư_vấn hướng_dẫn_nhiệt_tình tốt,162,5,0,1
5,"Chuyên nghiệp, thân thiện. Đẹp như mô tả. Giá tốt. Giao hàng nhanh bất ngờ. Hàng đúng mô tả tả mỏng , nên mua nha mn",1,chuyên nghiệp thân thiện đẹp như mô tả giá tốt giao hàng nhanh bất ngờ hàng đúng mô tả tả mỏng nên mua nha mn,chuyên_nghiệp thân_thiện đẹp như_mô_tả giá_tốt giao_hàng hàng đúng_mô_tả_tả mỏng,116,5,1,1
5,"bỉm nhà nghèo chất lượng nhà giàu ạ, tính ra giá cũng rẻ mà mỏng thoải mái nhưng thấm hút rất tốt luôn",1,bỉm nhà nghèo chất lượng nhà giàu ạ tính ra giá cũng rẻ mà mỏng thoải mái nhưng thấm hút rất tốt luôn,bỉm nghèo chất_lượng giàu giá rẻ mỏng thoải_mái thấm hút rất_tốt,101,1,1,1
5,"Sản phẩm/dịch vụ giống mô tả và tốt hơn mong đợi. Chất lượng sản phẩm/dịch vụ rất tốt. Gửi sản phẩm/vé dịch vụ nhanh. Shop tư vấn, hướng dẫn cực kỳ nhiệt tình. hàng xóm sang thấy bỉm dùng thích quá. nhờ đặt hộ 1 combo luôn",1,sản phẩm dịch vụ giống mô tả và tốt hơn mong đợi chất lượng sản phẩm dịch vụ rất tốt gửi sản phẩm vé dịch vụ nhanh shop tư vấn hướng dẫn cực kỳ nhiệt tình hàng xóm sang thấy bỉm dùng thích quá nhờ đặt hộ 1 combo luôn,sản_phẩm_dịch_vụ_giống_mô_tả tốt_hơn_mong_đợi chất_lượng sản_phẩm_dịch_vụ_rất_tốt gửi_sản_phẩm vé_dịch_vụ cửa_hàng tư_vấn hướng_dẫn_nhiệt_tình hàng_xóm bỉm thích hộ,216,5,0,1
5,"Chuyên nghiệp, thân thiện. Đẹp như mô tả. Đóng gói kỹ lưỡng. Chất lượng tuyệt vời. Giá tốt. Giao hàng nhanh bất ngờ. sẽ ủng hộ shop",1,chuyên nghiệp thân thiện đẹp như mô tả đóng gói kỹ lưỡng chất lượng tuyệt vời giá tốt giao hàng nhanh bất ngờ sẽ ủng hộ shop,chuyên_nghiệp thân_thiện đẹp như_mô_tả đóng_gói_kỹ_lưỡng chất_lượng_tuyệt_vời giá_tốt giao_hàng ủng_hộ cửa_hàng,124,7,0,1
4,Sản phẩm/dịch vụ giống mô tả. Chất lượng sản phẩm/dịch vụ khá tốt. Gửi sản phẩm/vé dịch vụ nhanh. Shop phục vụ khá tốt. form bỉm hơi rộng nên mong shop tư vấn cho khách để khách biết..,1,sản phẩm dịch vụ giống mô tả chất lượng sản phẩm dịch vụ khá tốt gửi sản phẩm vé dịch vụ nhanh shop phục vụ khá tốt form bỉm hơi rộng nên mong shop tư vấn cho khách để khách biết,sản_phẩm_dịch_vụ_giống_mô_tả chất_lượng sản_phẩm_dịch_vụ_tốt gửi_sản_phẩm vé_dịch_vụ cửa_hàng phục_vụ_tốt form bỉm rộng cửa_hàng tư_vấn,178,3,0,1
5,bỉm mỏng dùng ok lắm shop nhé,1,bỉm mỏng dùng ok lắm shop nhé,bỉm mỏng ổn lắm cửa_hàng,29,1,1,1
5,"tã dày ngang vs bobby, thích hợp bận buổi tối cho bé ngủ, nhưng mới sài lần đầu, ko biết thấm hút tốt ko, sẽ đánh giá lại sao, khi sd cho bé, ok sẽ chuyển qua tã này dùng cho bé luôn, giá thành ghẻ hơn bobby, tiết kiệm cho những bà mẹ bỉm sữa.....",1,tã dày ngang vs bobby thích hợp bận buổi tối cho bé ngủ nhưng mới sài lần đầu ko biết thấm hút tốt ko sẽ đánh giá lại sao khi sd cho bé ok sẽ chuyển qua tã này dùng cho bé luôn giá thành ghẻ hơn bobby tiết kiệm cho những bà mẹ bỉm sữa,tã dày thích_hợp bận tối bé sài đầu thấm hút tốt không_sẽ bé ổn tã bé giá_thành ghẻ tiết_kiệm mẹ bỉm sữa,246,2,1,1
4,Sản phẩm/dịch vụ giống mô tả. Chất lượng sản phẩm/dịch vụ khá tốt. Gửi sản phẩm/vé dịch vụ nhanh. Shop phục vụ khá tốt. tã thấm hút tốt,1,sản phẩm dịch vụ giống mô tả chất lượng sản phẩm dịch vụ khá tốt gửi sản phẩm vé dịch vụ nhanh shop phục vụ khá tốt tã thấm hút tốt,sản_phẩm_dịch_vụ_giống_mô_tả chất_lượng sản_phẩm_dịch_vụ_tốt gửi_sản_phẩm vé_dịch_vụ cửa_hàng phục_vụ_tốt tã thấm hút tốt,131,4,0,1
5,"Sản phẩm/dịch vụ giống mô tả và tốt hơn mong đợi. Chất lượng sản phẩm/dịch vụ rất tốt. Gửi sản phẩm/vé dịch vụ nhanh. Shop tư vấn, hướng dẫn cực kỳ nhiệt tình. hết e sẽ mua ủng hộ thêm shop.",1,sản phẩm dịch vụ giống mô tả và tốt hơn mong đợi chất lượng sản phẩm dịch vụ rất tốt gửi sản phẩm vé dịch vụ nhanh shop tư vấn hướng dẫn cực kỳ nhiệt tình hết e sẽ mua ủng hộ thêm shop,sản_phẩm_dịch_vụ_giống_mô_tả tốt_hơn_mong_đợi chất_lượng sản_phẩm_dịch_vụ_rất_tốt gửi_sản_phẩm vé_dịch_vụ cửa_hàng tư_vấn hướng_dẫn_nhiệt_tình ủng_hộ cửa_hàng,185,4,0,1
