rating,content,class,content_clean,content_clean_pt,length,positive_count,negative_count,class_new
3,Chất lượng ổn. mua 2 con toàn là màu đen. mặc dù có ghi chú chó shop đừng giao màu đen,0,chất lượng ổn mua 2 con toàn là màu đen mặc dù có ghi chú chó shop đừng giao màu đen,chất_lượng_ổn toàn màu đen mặc_dù ghi_chú chó cửa_hàng đừng màu đen,84,1,0,1
5,hàng goi ok.nhug hàng thi tệ ko sử dụng dc mua ve gio vut xó.buc het minh chờ hàng 1tuần mới nhận được. nhan rui mat tien ma ko xài dc,1,hàng goi ok nhug hàng thi tệ ko sử dụng dc mua ve gio vut xó buc het minh chờ hàng 1tuần mới nhận được nhan rui mat tien ma ko xài dc,hàng_ổn hàng thi_tệ không_sử_dụng ve_gio vut_xó het_minh chờ hàng tuần nhan_rui không_xài,143,1,0,1
1,Cần đúng với mô tả. Chất lượng cần tốt hơn. Giao hàng cần nhanh hơn.,0,cần đúng với mô tả chất lượng cần tốt hơn giao hàng cần nhanh hơn,mô_tả chất_lượng_cần_tốt_hơn giao_hàng,65,0,1,0
5,Đóng gói kỹ lưỡng. Giá tốt. Chất lượng tuyệt vời. Đẹp như mô tả.,1,đóng gói kỹ lưỡng giá tốt chất lượng tuyệt vời đẹp như mô tả,đóng_gói_kỹ_lưỡng giá_tốt chất_lượng_tuyệt_vời đẹp như_mô_tả,60,5,0,1
4,"Đóng gói kỹ. Đúng mô tả. ngoại quan về sp khá okie. sp có vẻ hơi yếu, chơi đừng va chạm nhiều, dễ bể hoặc gãy. độ bền thì để dùng thử mới biết được.",1,đóng gói kỹ đúng mô tả ngoại quan về sp khá okie sp có vẻ hơi yếu chơi đừng va chạm nhiều dễ bể hoặc gãy độ bền thì để dùng thử mới biết được,đóng_gói kỹ_đúng_mô_tả ngoại_quan sản_phẩm ổnie sản_phẩm_vẻ yếu_chơi đừng va_chạm bể gãy độ bền thử,153,0,0,1
3,Chất lượng ổn. Đúng mô tả.,0,chất lượng ổn đúng mô tả,chất_lượng_ổn đúng_mô_tả,24,2,0,1
5,"giá tốt. tuy nhiên ko phải full carbon. chỉ có 2 lớp ngoài là carbon thui, vân carbon to chắc 6k hay j đó",1,giá tốt tuy nhiên ko phải full carbon chỉ có 2 lớp ngoài là carbon thui vân carbon to chắc 6k hay j đó,giá_tốt lớp thui_vân ngàn,110,1,0,1
5,"Chuyên nghiệp, thân thiện. Đẹp như mô tả. Đóng gói kỹ lưỡng. Chất lượng tuyệt vời. Giá tốt. Giao hàng nhanh bất ngờ. Shop tư vấn về sản phẩm rất tận tình!!!!",1,chuyên nghiệp thân thiện đẹp như mô tả đóng gói kỹ lưỡng chất lượng tuyệt vời giá tốt giao hàng nhanh bất ngờ shop tư vấn về sản phẩm rất tận tình,chuyên_nghiệp thân_thiện đẹp như_mô_tả đóng_gói_kỹ_lưỡng chất_lượng_tuyệt_vời giá_tốt giao_hàng cửa_hàng tư_vấn sản_phẩm tận_tình,146,7,0,1
5,"Chuyên nghiệp, thân thiện. Đẹp như mô tả. Đóng gói kỹ lưỡng. Hàng đẹp",1,chuyên nghiệp thân thiện đẹp như mô tả đóng gói kỹ lưỡng hàng đẹp,chuyên_nghiệp thân_thiện đẹp như_mô_tả đóng_gói_kỹ_lưỡng hàng_đẹp,65,6,0,1
3,Chưa chuyên nghiệp.,0,chưa chuyên nghiệp,chưa_chuyên_nghiệp,18,0,1,0
5,Giá tốt. Chất lượng tuyệt vời. Đóng gói kỹ lưỡng. Đẹp như mô tả.,1,giá tốt chất lượng tuyệt vời đóng gói kỹ lưỡng đẹp như mô tả,giá_tốt chất_lượng_tuyệt_vời đóng_gói_kỹ_lưỡng đẹp như_mô_tả,60,5,0,1
4,giao hơi lâu,1,giao hơi lâu,,12,0,0,1
5,"Chuyên nghiệp, thân thiện. Đẹp như mô tả. Đóng gói kỹ lưỡng. Chất lượng tuyệt vời. Giá tốt. Giao hàng nhanh bất ngờ. ok ủng hộ shop lần tới",1,chuyên nghiệp thân thiện đẹp như mô tả đóng gói kỹ lưỡng chất lượng tuyệt vời giá tốt giao hàng nhanh bất ngờ ok ủng hộ shop lần tới,chuyên_nghiệp thân_thiện đẹp như_mô_tả đóng_gói_kỹ_lưỡng chất_lượng_tuyệt_vời giá_tốt giao_hàng_ổn ủng_hộ cửa_hàng,132,8,0,1
1,Hàng giao không giống quảng cáo,0,hàng giao không giống quảng cáo,hàng không_giống quảng_cáo,31,0,0,0
5,"sản phẩm như hình, máy bay nhỏ xinh dễ thương, giao hàng nhanh",1,sản phẩm như hình máy bay nhỏ xinh dễ thương giao hàng nhanh,sản_phẩm hình máy_bay xinh_dễ_thương giao_hàng,60,0,0,1
4,cũng được,1,cũng được,,9,0,0,1
5,ưng ý lắm shop ạ,1,ưng ý lắm shop ạ,ưng_ý lắm cửa_hàng,16,1,0,1
5,Đẹp như mô tả. juuhgc . nhc,1,đẹp như mô tả juuhgc nhc,đẹp như_mô_tả juuhgc nhc,24,2,0,1
1,Không sử dụng được,0,không sử dụng được,không_sử_dụng,18,0,0,0
5,lmm điều khiển đc ***,1,lmm điều khiển đc ***,lmm điều_khiển * * *,23,0,0,1
1,"Đóng gói hàng không cẩn thận/Vé dịch vụ rách, mờ, không rõ thông tin. Giao sai hàng. Liên hệ nhiều lần, shop nói sẽ đổi hàng mà mình đã trả hàng mấy tuần mới nhận lại dc hàng đổi của shop. Mình liên hệ để lấy lại phí ship mà shop đã thỏa thuận trả mà ko thấy shop liên hệ luôn. Nhưng qua việc này, thấy Sendo làm việc rất tích cực, đã thay chủ shop hoàn tiền ship lại cho mình. Nói chung lần đầu tiên đặt Sendo mà cảm thấy rất ko hài lòng như vậy. Những lần khác thì vẫn tốt.",0,đóng gói hàng không cẩn thận vé dịch vụ rách mờ không rõ thông tin giao sai hàng liên hệ nhiều lần shop nói sẽ đổi hàng mà mình đã trả hàng mấy tuần mới nhận lại dc hàng đổi của shop mình liên hệ để lấy lại phí ship mà shop đã thỏa thuận trả mà ko thấy shop liên hệ luôn nhưng qua việc này thấy sendo làm việc rất tích cực đã thay chủ shop hoàn tiền ship lại cho mình nói chung lần đầu tiên đặt sendo mà cảm thấy rất ko hài lòng như vậy những lần khác thì vẫn tốt,đóng_gói hàng_không cẩn_thận vé_dịch_vụ rách_mờ_không_rõ thông_tin hàng liên_hệ cửa_hàng đổi hàng hàng mấy tuần hàng đổi cửa_hàng liên_hệ phí giao_hàng cửa_hàng thỏa_thuận không_thấy cửa_hàng liên_hệ sendo làm_việc tích_cực chủ cửa_hàng hoàn tiền giao_hàng sendo không_hài_lòng tốt,481,2,0,1
5,"Sản phẩm/dịch vụ giống mô tả và tốt hơn mong đợi. Chất lượng sản phẩm/dịch vụ rất tốt. Gửi sản phẩm/vé dịch vụ nhanh. Shop tư vấn, hướng dẫn cực kỳ nhiệt tình. sản phẩm quá đẹp và giao hàng cực nhanh.1 ngày sau nhận đc hàng luôn.shop tư vấn cực kì nhiệt tình.vô cùng hài lòng.ai có nhu cầu mua đồ chơi cho con hoặc làm quà tặng thì cứ yên tâm mà mua ở shop này.hàng đẹp và uy tín.",1,sản phẩm dịch vụ giống mô tả và tốt hơn mong đợi chất lượng sản phẩm dịch vụ rất tốt gửi sản phẩm vé dịch vụ nhanh shop tư vấn hướng dẫn cực kỳ nhiệt tình sản phẩm quá đẹp và giao hàng cực nhanh 1 ngày sau nhận đc hàng luôn shop tư vấn cực kì nhiệt tình vô cùng hài lòng ai có nhu cầu mua đồ chơi cho con hoặc làm quà tặng thì cứ yên tâm mà mua ở shop này hàng đẹp và uy tín,sản_phẩm_dịch_vụ_giống_mô_tả tốt_hơn_mong_đợi chất_lượng sản_phẩm_dịch_vụ_rất_tốt gửi_sản_phẩm vé_dịch_vụ cửa_hàng tư_vấn hướng_dẫn_nhiệt_tình sản_phẩm_đẹp giao_hàng cực hàng cửa_hàng_tư_vấn cực_kì nhiệt_tình vô_cùng hài_lòng nhu_cầu đồ_chơi làm_quà tặng yên_tâm cửa_hàng hàng_đẹp uy_tín,376,7,0,1
5,Chất lượng sản phẩm/dịch vụ rất tốt. Gửi sản phẩm/vé dịch vụ nhanh. rất OK,1,chất lượng sản phẩm dịch vụ rất tốt gửi sản phẩm vé dịch vụ nhanh rất ok,chất_lượng sản_phẩm_dịch_vụ_rất_tốt gửi_sản_phẩm vé_dịch_vụ_ổn,72,2,0,1
5,"Sản phẩm/dịch vụ giống mô tả và tốt hơn mong đợi. Chất lượng sản phẩm/dịch vụ rất tốt. Gửi sản phẩm/vé dịch vụ nhanh. Shop tư vấn, hướng dẫn cực kỳ nhiệt tình. Hàng tốt, chủ shop nhiệt tình vui vẻ. Ai có nhu cầu cứ yên tâm mà mua nhé. Tiếp tục ủng hộ shop",1,sản phẩm dịch vụ giống mô tả và tốt hơn mong đợi chất lượng sản phẩm dịch vụ rất tốt gửi sản phẩm vé dịch vụ nhanh shop tư vấn hướng dẫn cực kỳ nhiệt tình hàng tốt chủ shop nhiệt tình vui vẻ ai có nhu cầu cứ yên tâm mà mua nhé tiếp tục ủng hộ shop,sản_phẩm_dịch_vụ_giống_mô_tả tốt_hơn_mong_đợi chất_lượng sản_phẩm_dịch_vụ_rất_tốt gửi_sản_phẩm vé_dịch_vụ cửa_hàng tư_vấn hướng_dẫn_nhiệt_tình hàng_tốt chủ cửa_hàng_nhiệt_tình vui_vẻ nhu_cầu yên_tâm ủng_hộ cửa_hàng,247,7,0,1
5,"Sản phẩm/dịch vụ giống mô tả và tốt hơn mong đợi. Sản phẩm như mô tả, giao hàng tốt, cho 5 sao để tiếp tục phát triển",1,sản phẩm dịch vụ giống mô tả và tốt hơn mong đợi sản phẩm như mô tả giao hàng tốt cho 5 sao để tiếp tục phát triển,sản_phẩm_dịch_vụ_giống_mô_tả tốt_hơn_mong_đợi sản_phẩm_như_mô_tả giao_hàng_tốt _sao phát_triển,114,5,0,1
1,"Giao hàng quá kém, thiếu hàng , chờ đợi quá lâu ko. Có phản hồi",0,giao hàng quá kém thiếu hàng chờ đợi quá lâu ko có phản hồi,giao_hàng_kém hàng chờ_đợi lâu_không_có phản_hồi,62,0,1,0
5,"Gửi sản phẩm/vé dịch vụ nhanh. Sản phẩm/dịch vụ giống mô tả và tốt hơn mong đợi. Chất lượng sản phẩm/dịch vụ rất tốt. Shop tư vấn, hướng dẫn cực kỳ nhiệt tình. Ok lắm ae",1,gửi sản phẩm vé dịch vụ nhanh sản phẩm dịch vụ giống mô tả và tốt hơn mong đợi chất lượng sản phẩm dịch vụ rất tốt shop tư vấn hướng dẫn cực kỳ nhiệt tình ok lắm ae,gửi_sản_phẩm vé_dịch_vụ sản_phẩm_dịch_vụ_giống_mô_tả tốt_hơn_mong_đợi chất_lượng sản_phẩm_dịch_vụ_rất_tốt cửa_hàng tư_vấn hướng_dẫn nhiệt_tình_ổn lắm anh_em,168,3,0,1
5,"Chất lượng sản phẩm/dịch vụ rất tốt. Gửi sản phẩm/vé dịch vụ nhanh. Shop tư vấn, hướng dẫn cực kỳ nhiệt tình. Sản phẩm/dịch vụ giống mô tả và tốt hơn mong đợi.",1,chất lượng sản phẩm dịch vụ rất tốt gửi sản phẩm vé dịch vụ nhanh shop tư vấn hướng dẫn cực kỳ nhiệt tình sản phẩm dịch vụ giống mô tả và tốt hơn mong đợi,chất_lượng sản_phẩm_dịch_vụ_rất_tốt gửi_sản_phẩm vé_dịch_vụ cửa_hàng tư_vấn hướng_dẫn_nhiệt_tình sản_phẩm_dịch_vụ_giống_mô_tả tốt_hơn_mong_đợi,154,4,0,1
5,"shop phuc vu tot, da dat mua them lan thu 2",1,shop phuc vu tot da dat mua them lan thu 2,cửa_hàng_tốt,42,1,0,1
5,Gửi sản phẩm/vé dịch vụ nhanh. pin khá bền,1,gửi sản phẩm vé dịch vụ nhanh pin khá bền,gửi_sản_phẩm vé_dịch_vụ bền,41,0,0,1
5,Sản phẩm/dịch vụ giống mô tả và tốt hơn mong đợi. rất hài lòng về chất lượng,1,sản phẩm dịch vụ giống mô tả và tốt hơn mong đợi rất hài lòng về chất lượng,sản_phẩm_dịch_vụ_giống_mô_tả tốt_hơn_mong_đợi hài_lòng chất_lượng,75,2,0,1
5,Thấy ổn,1,thấy ổn,ổn,7,1,0,1
5,"Chuyên nghiệp, thân thiện. Đóng gói kỹ lưỡng. Chất lượng tuyệt vời. Giá tốt. xe giống như mô tả đẹp mà có điều bị trầy do chắc dau hàng",1,chuyên nghiệp thân thiện đóng gói kỹ lưỡng chất lượng tuyệt vời giá tốt xe giống như mô tả đẹp mà có điều bị trầy do chắc dau hàng,chuyên_nghiệp thân_thiện đóng_gói_kỹ_lưỡng chất_lượng_tuyệt_vời giá_tốt như_mô_tả đẹp trầy hàng,130,7,0,1
5,Sp giống với mô tả,1,sp giống với mô tả,sản_phẩm mô_tả,24,0,0,1
2,Giao hàng cần nhanh hơn. sản phẩm thì OK nhưng cần giao hàng nhanh hơn shop nha lần sau cần mình vẫn ủng hộ shop,0,giao hàng cần nhanh hơn sản phẩm thì ok nhưng cần giao hàng nhanh hơn shop nha lần sau cần mình vẫn ủng hộ shop,giao_hàng sản_phẩm_ổn giao_hàng cửa_hàng_nha ủng_hộ cửa_hàng,111,1,0,1
5,"siêu dep nen mua moi nga , giao sieu nhanh",1,siêu dep nen mua moi nga giao sieu nhanh,giao_sieu,40,0,0,1
3,Giá hơi đắt. Đắt so với chất lượng.,0,giá hơi đắt đắt so với chất lượng,giá đắt đắt chất_lượng,33,0,0,0
5,"Sản phẩm/dịch vụ giống mô tả và tốt hơn mong đợi. Gửi sản phẩm/vé dịch vụ nhanh. Shop tư vấn, hướng dẫn cực kỳ nhiệt tình. Shop rất nhiệt tình hỗ trợ khách hàng, sản phẩm chất lượng và giá cực kì tốt. Sẽ ủng hộ lần sau!!",1,sản phẩm dịch vụ giống mô tả và tốt hơn mong đợi gửi sản phẩm vé dịch vụ nhanh shop tư vấn hướng dẫn cực kỳ nhiệt tình shop rất nhiệt tình hỗ trợ khách hàng sản phẩm chất lượng và giá cực kì tốt sẽ ủng hộ lần sau,sản_phẩm_dịch_vụ_giống_mô_tả tốt_hơn_mong_đợi gửi_sản_phẩm vé_dịch_vụ cửa_hàng tư_vấn hướng_dẫn_nhiệt_tình cửa_hàng_nhiệt_tình khách_hàng sản_phẩm chất_lượng_giá cực_kì tốt ủng_hộ,212,5,0,1
5,phần đóng gói hơi qua loa. sản phẩm đẹp,1,phần đóng gói hơi qua loa sản phẩm đẹp,đóng_gói qua_loa sản_phẩm_đẹp,38,1,0,1
2,Giao hàng cần nhanh hơn.,0,giao hàng cần nhanh hơn,giao_hàng,23,0,0,0
5,cho 5 sao.,1,cho 5 sao,_sao,9,1,0,1
4,tạm không có pin,1,tạm không có pin,tạm,16,0,0,1
4,Sản phẩm/dịch vụ giống mô tả. Chất lượng sản phẩm/dịch vụ khá tốt. hơi buồn tý vì ống hơi bị móp chắc do vận chuyển nhưng mà không sao sản phẩm tốt,1,sản phẩm dịch vụ giống mô tả chất lượng sản phẩm dịch vụ khá tốt hơi buồn tý vì ống hơi bị móp chắc do vận chuyển nhưng mà không sao sản phẩm tốt,sản_phẩm_dịch_vụ_giống_mô_tả chất_lượng sản_phẩm_dịch_vụ_tốt buồn_tý ống móp vận_chuyển không_sao sản_phẩm_tốt,145,3,0,1
5,Chất lượng sản phẩm/dịch vụ rất tốt. tuyệt vời,1,chất lượng sản phẩm dịch vụ rất tốt tuyệt vời,chất_lượng sản_phẩm_dịch_vụ_rất_tốt tuyệt_vời,45,2,0,1
3,Sản phẩm/dịch vụ tương đối giống mô tả. Chất lượng sản phẩm/dịch vụ tương đối tốt.,0,sản phẩm dịch vụ tương đối giống mô tả chất lượng sản phẩm dịch vụ tương đối tốt,sản_phẩm_dịch_vụ tương_đối giống_mô_tả chất_lượng sản_phẩm_dịch_vụ tương_đối tốt,80,2,0,1
4,"giao hàng lâu , túi cũng đẹp mà giao nhầm màu đặt màu đen lại giao màu xanh",1,giao hàng lâu túi cũng đẹp mà giao nhầm màu đặt màu đen lại giao màu xanh,giao_hàng lâu_túi đẹp nhầm màu màu đen màu,73,1,0,1
5,Đẹp như mô tả. Đóng gói kỹ lưỡng. Chất lượng tuyệt vời. Giá tốt. Tưởng hàng tào lao ai dè nhận hàng mới thấy đẹp tuyệt vời... Thanks shop....,1,đẹp như mô tả đóng gói kỹ lưỡng chất lượng tuyệt vời giá tốt tưởng hàng tào lao ai dè nhận hàng mới thấy đẹp tuyệt vời thanks shop,đẹp như_mô_tả đóng_gói_kỹ_lưỡng chất_lượng_tuyệt_vời giá_tốt tưởng hàng tào_lao dè hàng_đẹp tuyệt_vời cửa_hàng,130,7,0,1
5,"Chuyên nghiệp, thân thiện. Đẹp như mô tả. Chất lượng tuyệt vời. Giao hàng nhanh bất ngờ. đẹp",1,chuyên nghiệp thân thiện đẹp như mô tả chất lượng tuyệt vời giao hàng nhanh bất ngờ đẹp,chuyên_nghiệp thân_thiện đẹp như_mô_tả chất_lượng_tuyệt_vời giao_hàng_đẹp,87,6,0,1
5,"Chuyên nghiệp, thân thiện. Đẹp như mô tả. Giá tốt. Giao hàng nhanh bất ngờ. đẹp",1,chuyên nghiệp thân thiện đẹp như mô tả giá tốt giao hàng nhanh bất ngờ đẹp,chuyên_nghiệp thân_thiện đẹp như_mô_tả giá_tốt giao_hàng_đẹp,74,6,0,1
5,hàng đẹp mà hơi tiết vá gửi nhà vận chuyển đi bị hư mốc khóa hết chơn nhưn vẩn cho shop 5 sao,1,hàng đẹp mà hơi tiết vá gửi nhà vận chuyển đi bị hư mốc khóa hết chơn nhưn vẩn cho shop 5 sao,hàng đẹp_tiết vá gửi vận_chuyển_hư mốc khóa chơn nhưn vẩn cửa_hàng_ _sao,93,1,1,1
5,Sản phẩm đúng như vậy mô tả cảm ơn shop,1,sản phẩm đúng như vậy mô tả cảm ơn shop,sản_phẩm mô_tả cửa_hàng,39,0,0,1
5,ủa e đặt túi đeo mà shop giao cho e cái gì z thất vọng quá,1,ủa e đặt túi đeo mà shop giao cho e cái gì z thất vọng quá,túi đeo cửa_hàng_thất_vọng,62,0,1,0
5,"Chuyên nghiệp, thân thiện. Đẹp như mô tả. Chất lượng tuyệt vời. Giá tốt. đẹp",1,chuyên nghiệp thân thiện đẹp như mô tả chất lượng tuyệt vời giá tốt đẹp,chuyên_nghiệp thân_thiện đẹp như_mô_tả chất_lượng_tuyệt_vời giá tốt_đẹp,71,5,0,1
5,chất lượng phù với giá tiền 57k,1,chất lượng phù với giá tiền 57k,chất_lượng phù_giá tiền ngàn,35,0,0,1
5,"Chuyên nghiệp, thân thiện. Đóng gói kỹ lưỡng. Giao hàng nhanh bất ngờ. xe 4 chỗ nhưng chỉ mở dc có 2 cửa thôi sao a.",1,chuyên nghiệp thân thiện đóng gói kỹ lưỡng giao hàng nhanh bất ngờ xe 4 chỗ nhưng chỉ mở dc có 2 cửa thôi sao a,chuyên_nghiệp thân_thiện đóng_gói_kỹ_lưỡng giao_hàng chỗ cửa,113,3,0,1
5,"Giao hàng nhanh chóng, sản phẩm giống quảng cáo, chất lượng",1,giao hàng nhanh chóng sản phẩm giống quảng cáo chất lượng,giao_hàng_nhanh_chóng sản_phẩm quảng_cáo chất_lượng,57,1,0,1
5,"Sản phẩm/dịch vụ giống mô tả và tốt hơn mong đợi. Chất lượng sản phẩm/dịch vụ rất tốt. Gửi sản phẩm/vé dịch vụ nhanh. Bộ sp rất chi tiết, màu sơn đẹp. Tuy nhiên bị thiếu mất 1 đế nhân vật. Shop nên ktra lại trước khi giao nha",1,sản phẩm dịch vụ giống mô tả và tốt hơn mong đợi chất lượng sản phẩm dịch vụ rất tốt gửi sản phẩm vé dịch vụ nhanh bộ sp rất chi tiết màu sơn đẹp tuy nhiên bị thiếu mất 1 đế nhân vật shop nên ktra lại trước khi giao nha,sản_phẩm_dịch_vụ_giống_mô_tả tốt_hơn_mong_đợi chất_lượng sản_phẩm_dịch_vụ_rất_tốt gửi_sản_phẩm vé_dịch_vụ nhanh_bộ sản_phẩm chi_tiết màu sơn đẹp đế nhân_vật cửa_hàng kiểm_tra,229,4,0,1
5,hang donh goi khong chat luong hang bi be,1,hang donh goi khong chat luong hang bi be,donh chất_lượng bi_be,41,0,0,1
5,Đẹp như mô tả. nhưng hơi nhỏ,1,đẹp như mô tả nhưng hơi nhỏ,đẹp như_mô_tả,27,2,0,1
1,"Cần đúng với mô tả. đây hàng đây mới khui,trông như đã dùng 2 3 tháng xong gửi đi ko",0,cần đúng với mô tả đây hàng đây mới khui trông như đã dùng 2 3 tháng xong gửi đi ko,mô_tả hàng trông gửi không,86,0,0,0
1,Chất lượng cần tốt hơn. Giao hàng cần nhanh hơn. 3cái Sài được 2cái tay nghe bên trái 1cái sạc ko vo còn mấy tay nghe ben phải ko Sài dc,0,chất lượng cần tốt hơn giao hàng cần nhanh hơn 3cái sài được 2cái tay nghe bên trái 1cái sạc ko vo còn mấy tay nghe ben phải ko sài dc,chất_lượng_cần_tốt_hơn giao_hàng sài trái sạc không_vo mấy không_sài,142,0,1,0
5,"Chuyên nghiệp, thân thiện. Đẹp như mô tả. Đóng gói kỹ lưỡng. Chất lượng tuyệt vời. Giá tốt. Giao hàng nhanh bất ngờ. đẹp",1,chuyên nghiệp thân thiện đẹp như mô tả đóng gói kỹ lưỡng chất lượng tuyệt vời giá tốt giao hàng nhanh bất ngờ đẹp,chuyên_nghiệp thân_thiện đẹp như_mô_tả đóng_gói_kỹ_lưỡng chất_lượng_tuyệt_vời giá_tốt giao_hàng_đẹp,113,8,0,1
5,"Chuyên nghiệp, thân thiện. Đẹp như mô tả. Đóng gói kỹ lưỡng. Chất lượng tuyệt vời. Giá tốt. Giao hàng nhanh bất ngờ. hài lòng",1,chuyên nghiệp thân thiện đẹp như mô tả đóng gói kỹ lưỡng chất lượng tuyệt vời giá tốt giao hàng nhanh bất ngờ hài lòng,chuyên_nghiệp thân_thiện đẹp như_mô_tả đóng_gói_kỹ_lưỡng chất_lượng_tuyệt_vời giá_tốt giao_hàng hài_lòng,118,7,0,1
5,Gửi sản phẩm/vé dịch vụ nhanh. nhưng k giống hình,1,gửi sản phẩm vé dịch vụ nhanh nhưng k giống hình,gửi_sản_phẩm vé_dịch_vụ không_giống hình,52,0,0,1
5,"Đẹp như mô tả. Đóng gói kỹ lưỡng. Chất lượng tuyệt vời. rất ok đấy, xứng đáng với giá tiền",1,đẹp như mô tả đóng gói kỹ lưỡng chất lượng tuyệt vời rất ok đấy xứng đáng với giá tiền,đẹp như_mô_tả đóng_gói_kỹ_lưỡng chất_lượng_tuyệt_vời ổn đấy xứng_đáng_giá tiền,86,5,0,1
2,Chat luong nhua gia cong yeu ot noi co koi nhung kg keu kg dc hai long lam,0,chat luong nhua gia cong yeu ot noi co koi nhung kg keu kg dc hai long lam,chất_lượng nhua gia_cong ot_noi co_koi không_keu long_lam,82,0,0,0
5,"Chuyên nghiệp, thân thiện. Đẹp như mô tả. Đóng gói kỹ lưỡng. Chất lượng tuyệt vời. Giá tốt. Giao hàng nhanh bất ngờ. Sản phẩm đẹp, mở full cửa, full kính, âm thanh sống động, đèn trước và sau sáng , sẽ còn mua các sản phẩm tương tự, hài lòng ❤️❤️❤️",1,chuyên nghiệp thân thiện đẹp như mô tả đóng gói kỹ lưỡng chất lượng tuyệt vời giá tốt giao hàng nhanh bất ngờ sản phẩm đẹp mở full cửa full kính âm thanh sống động đèn trước và sau sáng sẽ còn mua các sản phẩm tương tự hài lòng yêu yêu yêu,chuyên_nghiệp thân_thiện đẹp như_mô_tả đóng_gói_kỹ_lưỡng chất_lượng_tuyệt_vời giá_tốt giao_hàng sản_phẩm_đẹp cửa kính âm_thanh sống_động đèn sản_phẩm tương_tự hài_lòng yêu yêu yêu,239,8,0,1
1,"Cần đúng với mô tả. Chất lượng cần tốt hơn. nên kiểm tra và có trách nhiêm trước khi giao hàng, hàng bị lỗi, bày vẽ hướng dẫn xử lý kéo dài thời gian đổi trả cuối cùng ko đổi hàng, ko nên mua tránh tiền mất tật mang nha mọi người",0,cần đúng với mô tả chất lượng cần tốt hơn nên kiểm tra và có trách nhiêm trước khi giao hàng hàng bị lỗi bày vẽ hướng dẫn xử lý kéo dài thời gian đổi trả cuối cùng ko đổi hàng ko nên mua tránh tiền mất tật mang nha mọi người,mô_tả chất_lượng_cần_tốt_hơn kiểm_tra trách nhiêm giao_hàng hàng lỗi bày_vẽ hướng_dẫn kéo_dài đổi không_đổi hàng_không tiền_mất_tật_mang,230,0,1,0
1,shop bán hàng kiểu gì mà mua về ko bay dc tí nào.máy ko nhúc nhích,0,shop bán hàng kiểu gì mà mua về ko bay dc tí nào máy ko nhúc nhích,cửa_hàng hàng kiểu không_bay tí máy không_nhúc_nhích,74,0,0,0
5,"khăn đẹp nhưng để quẩn em bé thì tốt hơn là để tắm. Nói chung cũng ổn,với giá tiền phù hợp và được tặng thêm sáp thơm. tiếc là mua để tắm thì không thích lắm.",1,khăn đẹp nhưng để quẩn em bé thì tốt hơn là để tắm nói chung cũng ổn với giá tiền phù hợp và được tặng thêm sáp thơm tiếc là mua để tắm thì không thích lắm,khăn đẹp quẩn bé tốt ổn giá tiền tặng sáp thơm_tiếc không_thích lắm,183,3,1,1
5,Giao hàng nhanh bất ngờ. Xe to như cái kẹo. Nhưng rất dễ thương và vui mắt.,1,giao hàng nhanh bất ngờ xe to như cái kẹo nhưng rất dễ thương và vui mắt,giao_hàng kẹo dễ_thương mắt,72,0,1,0
3,"Giao hàng lâu, xe kg có đc cái hộp luôn",0,giao hàng lâu xe kg có đc cái hộp luôn,giao_hàng hộp,43,0,0,0
1,Hư 1 xe k chạy đà được,0,hư 1 xe k chạy đà được,hư không_chạy đà,26,0,1,0
5,"sp rất đẹp, con m rất thích",1,sp rất đẹp con m rất thích,sản_phẩm_đẹp rất_thích,32,2,0,1
5,"Đóng gói kỹ lưỡng. Giao hàng nhanh bất ngờ. Đã nhận hàng, đúng theo QC,",1,đóng gói kỹ lưỡng giao hàng nhanh bất ngờ đã nhận hàng đúng theo qc,đóng_gói_kỹ_lưỡng giao_hàng hàng quảng_cáo,74,1,0,1
